{"schemaVersion":"1.0.0","kind":"plan","identity":"sha256:0258949237d17be77d65fa73bd1e6863e7e94a23577c1e2b867201b1153d206f","repository":"nucleoid/delivery-forge","workItem":"#3","mode":"implement","planRevision":"revision-1","baseCommit":"6304c90f83df3cdb918dff03f6358dcf4a939d16","createdAt":"2026-10-07T04:43:12Z","scope":{"outcome":"Define executable contracts","included":["schemas","core"],"excluded":["CLI"]},"acceptanceCriteria":["Canonical identities are stable"]}
